{
  "actions": [
    {
      "capacity_egress_mbps": 10000000,
      "capacity_viewers": 10000000,
      "deadline_at": 69,
      "generation": 4,
      "idempotency_key": "sha256:6ad4e1f6bce692f1426cb1f26e6638fd5755d8ed77044f03fd128dd423d2e225",
      "node_id": "milestone-local-origin-000001",
      "operation": "destroy",
      "placement": {
        "provider": "local-sim-a",
        "region": "eu-south",
        "zone": "zone-a"
      },
      "reason": "safe_shutdown",
      "requires_drained": true,
      "tier": "origin"
    },
    {
      "capacity_egress_mbps": 100,
      "capacity_viewers": 60,
      "deadline_at": 69,
      "generation": 4,
      "idempotency_key": "sha256:56dcee40a5e4ce57e7ae5de54c2440214bb6fefa36343a29c796d2ebdfb8ded8",
      "node_id": "milestone-local-core-000003",
      "operation": "destroy",
      "placement": {
        "provider": "local-sim-b",
        "region": "eu-west",
        "zone": "zone-b"
      },
      "reason": "safe_shutdown",
      "requires_drained": true,
      "tier": "core"
    },
    {
      "capacity_egress_mbps": 100,
      "capacity_viewers": 60,
      "deadline_at": 69,
      "generation": 4,
      "idempotency_key": "sha256:cbece1ef558a510d48e5fcb52d76dfe4ef486ec2a70af084b57178d93927326e",
      "node_id": "milestone-local-core-000004",
      "operation": "destroy",
      "placement": {
        "provider": "local-sim-a",
        "region": "eu-south",
        "zone": "zone-a"
      },
      "reason": "safe_shutdown",
      "requires_drained": true,
      "tier": "core"
    }
  ],
  "config_digest": "sha256:68e94c063b6e3fb51225dd0a815b61e5e3b496d1619fadf5b509003e8be23fe6",
  "deployment_id": "milestone-local",
  "generation": 4,
  "image_digest": "sha256:07265afea47294d8bac3e450fb16c8c06403e9e4b86575d5816210f76ed8dd0b",
  "partition": "eu-south",
  "schema_version": 1
}
