{
  "actions": [
    {
      "capacity_egress_mbps": 100,
      "capacity_viewers": 60,
      "deadline_at": 140,
      "generation": 2,
      "idempotency_key": "sha256:d033a6f48cf2f2fc0ff86ddef804bdd70a6f25e31dfa8a0d91a72cbaef2d588f",
      "node_id": "milestone-local-core-000003",
      "operation": "create",
      "placement": {
        "provider": "local-sim-b",
        "region": "eu-west",
        "zone": "zone-b"
      },
      "reason": "autoscale_out",
      "requires_drained": false,
      "tier": "core"
    }
  ],
  "config_digest": "sha256:68e94c063b6e3fb51225dd0a815b61e5e3b496d1619fadf5b509003e8be23fe6",
  "deployment_id": "milestone-local",
  "generation": 2,
  "image_digest": "sha256:07265afea47294d8bac3e450fb16c8c06403e9e4b86575d5816210f76ed8dd0b",
  "partition": "eu-south",
  "schema_version": 1
}
